{
  "generated_at": "2026-09-29T16:01:41",
  "agent_health": {
    "source": "reports/agent/health.json",
    "generated_at": "2026-09-29T16:01:27",
    "missing": false,
    "data": {
      "status": "READY",
      "failed": []
    }
  },
  "tool_health": {
    "source": "reports/agent/doctor.json",
    "generated_at": "2026-09-29T16:01:40",
    "missing": false,
    "data": {
      "status": "HEALTHY",
      "critical_failures": 0,
      "warnings": 0,
      "versions": {
        "python": "3.14.0rc2",
        "django": "6.1.1",
        "node": "v22.22.2",
        "npm": "10.9.7",
        "git": "git version 2.43.0",
        "npm:@axe-core/playwright": "4.10.2",
        "npm:@modelcontextprotocol/sdk": "1.31.0",
        "npm:@playwright/test": "1.56.0",
        "npm:@types/node": "22.10.2",
        "npm:@types/pngjs": "6.0.5",
        "npm:pixelmatch": "7.1.0",
        "npm:pngjs": "7.0.0",
        "npm:tsx": "4.23.15",
        "npm:typescript": "5.7.2",
        "npm:zod": "3.25.76",
        "ruff": "ruff 0.16.9",
        "bandit": "bandit 1.9.4",
        "pip-audit": "pip-audit 2.10.1",
        "chromium": "141.0.7390.37",
        "project-mcp tools": 106
      }
    }
  },
  "mcp_health": {
    "source": "reports/agent/self-test.json",
    "generated_at": "2026-09-29T15:50:32",
    "missing": false,
    "data": {
      "ok": true,
      "tools": 106,
      "steps_ok": 19,
      "steps": 19
    }
  },
  "plugin_health": {
    "source": "docs/agent/tool-registry.json",
    "generated_at": "2026-09-29T15:22:13",
    "missing": false,
    "data": {
      "READY": 41,
      "UNAVAILABLE": 9,
      "REQUIRES_MANUAL_CONNECTION": 4
    }
  },
  "test_health": {
    "source": "reports/testing/playwright-results.json",
    "generated_at": "2026-09-29T15:47:48",
    "missing": false,
    "data": {
      "startTime": "2026-09-29T18:43:13.985Z",
      "duration": 273164.783,
      "expected": 220,
      "skipped": 0,
      "unexpected": 0,
      "flaky": 0
    }
  },
  "page_coverage": {
    "source": "ui-inventory/routes.json",
    "generated_at": "2026-09-29T14:16:22",
    "missing": false,
    "data": {
      "pages_with_route": 52,
      "audited": 1,
      "not_audited_sample": [
        "/",
        "/_lab/",
        "/agenda/",
        "/agenda/escala/",
        "/ascom/imprensa/",
        "/ascom/imprensa/atendimentos/",
        "/ascom/imprensa/atendimentos/novo/",
        "/ascom/palestras/",
        "/ascom/palestras/lista/",
        "/ascom/palestras/nova/",
        "/ascom/publicacoes/",
        "/ascom/publicacoes/pautas/",
        "/ascom/publicacoes/pautas/nova/",
        "/cadastros/",
        "/coffee-break/",
        "/coffee-break/cadastros/importar-planilha/",
        "/coffee-break/certidoes/",
        "/coffee-break/lotes/",
        "/coffee-break/lotes/virada-de-exercicio/",
        "/coffee-break/solicitacoes/",
        "/coffee-break/solicitacoes/nova/",
        "/coffee-break/solicitacoes/nova/ordem-de-servico/",
        "/conta/alterar-senha/",
        "/conta/entrar/",
        "/conta/sair/",
        "/conta/senha/recuperar/",
        "/conta/senha/recuperar/concluido/",
        "/conta/senha/recuperar/enviado/",
        "/conta/usuarios/",
        "/conta/usuarios/novo/"
      ]
    }
  },
  "component_coverage": {
    "source": "ui-inventory/summary.json",
    "generated_at": "2026-09-29T14:16:23",
    "missing": false,
    "data": {
      "template_components": 40,
      "specimens_in_lab": 36
    }
  },
  "accessibility": {
    "source": "reports/accessibility",
    "generated_at": "2026-09-29T13:45:08",
    "missing": false,
    "data": {
      "pages": 21,
      "totals": {
        "critical": 5,
        "serious": 177,
        "moderate": 26,
        "minor": 1
      },
      "baseline": {
        "agenda": {
          "critical": 5,
          "serious": 49
        },
        "cadastros": {
          "critical": 0,
          "serious": 3
        },
        "coffee-lista": {
          "critical": 0,
          "serious": 3
        },
        "dashboard": {
          "critical": 0,
          "serious": 3
        },
        "erro-404": {
          "critical": 0,
          "serious": 4
        },
        "hub": {
          "critical": 0,
          "serious": 3
        },
        "imprensa-lista": {
          "critical": 0,
          "serious": 3
        },
        "login": {
          "critical": 0,
          "serious": 3
        },
        "oficios-lista": {
          "critical": 0,
          "serious": 3
        },
        "ordens-lista": {
          "critical": 0,
          "serious": 3
        },
        "palestras-lista": {
          "critical": 0,
          "serious": 3
        },
        "planos-lista": {
          "critical": 0,
          "serious": 3
        },
        "prestacoes-lista": {
          "critical": 0,
          "serious": 52
        },
        "publicacoes-lista": {
          "critical": 0,
          "serious": 5
        },
        "relatorios": {
          "critical": 0,
          "serious": 3
        },
        "roteiros-lista": {
          "critical": 0,
          "serious": 3
        },
        "solicitacoes-lista": {
          "critical": 0,
          "serious": 5
        },
        "solicitacoes-nova": {
          "critical": 0,
          "serious": 9
        },
        "termos-lista": {
          "critical": 0,
          "serious": 3
        },
        "viagem-lista": {
          "critical": 0,
          "serious": 3
        },
        "viagens-cadastros": {
          "critical": 0,
          "serious": 11
        }
      }
    }
  },
  "visual_regression": {
    "source": "tests/visual/snapshots",
    "generated_at": "2026-09-29T13:49:51",
    "missing": false,
    "data": {
      "baselines": 57
    }
  },
  "responsive": {
    "source": "reports/responsive",
    "generated_at": "2026-09-29T13:53:14",
    "missing": false,
    "data": {
      "combinations": 120,
      "overflow": [
        "agenda@mobile",
        "agenda@mobilePequeno",
        "dashboard@mobile",
        "dashboard@mobilePequeno",
        "oficios-lista@mobile",
        "oficios-lista@tabletRetrato",
        "oficios-lista@tablet",
        "oficios-lista@laptop",
        "oficios-lista@desktop",
        "oficios-lista@mobilePequeno",
        "ordens-lista@tabletRetrato",
        "ordens-lista@tablet",
        "ordens-lista@laptop",
        "ordens-lista@desktop",
        "planos-lista@tabletRetrato",
        "planos-lista@tablet",
        "planos-lista@laptop",
        "planos-lista@desktop",
        "prestacoes-lista@mobile",
        "prestacoes-lista@tabletRetrato",
        "prestacoes-lista@tablet",
        "prestacoes-lista@laptop",
        "prestacoes-lista@desktop",
        "prestacoes-lista@mobilePequeno",
        "roteiros-lista@tabletRetrato",
        "roteiros-lista@tablet",
        "roteiros-lista@laptop",
        "roteiros-lista@desktop",
        "termos-lista@tabletRetrato",
        "termos-lista@tablet",
        "termos-lista@laptop",
        "termos-lista@desktop",
        "viagem-lista@tabletRetrato",
        "viagem-lista@tablet",
        "viagem-lista@laptop",
        "viagem-lista@desktop",
        "viagens-cadastros@tabletRetrato",
        "viagens-cadastros@tablet",
        "viagens-cadastros@laptop",
        "viagens-cadastros@desktop"
      ]
    }
  },
  "performance": {
    "source": "reports/performance",
    "generated_at": "2026-09-29T13:56:57",
    "missing": false,
    "data": [
      {
        "page": "agenda",
        "ttfbMs": 34,
        "lcpMs": 284,
        "cls": 0.014,
        "htmlKB": 25,
        "requests": 16
      },
      {
        "page": "cadastros",
        "ttfbMs": 19,
        "lcpMs": 224,
        "cls": 0,
        "htmlKB": 14,
        "requests": 6
      },
      {
        "page": "coffee-lista",
        "ttfbMs": 72,
        "lcpMs": 328,
        "cls": 0,
        "htmlKB": 187,
        "requests": 7
      },
      {
        "page": "dashboard",
        "ttfbMs": 37,
        "lcpMs": 328,
        "cls": 0,
        "htmlKB": 80,
        "requests": 6
      },
      {
        "page": "hub",
        "ttfbMs": 148,
        "lcpMs": 400,
        "cls": 0,
        "htmlKB": 29,
        "requests": 7
      },
      {
        "page": "imprensa-lista",
        "ttfbMs": 37,
        "lcpMs": 240,
        "cls": 0,
        "htmlKB": 141,
        "requests": 6
      },
      {
        "page": "login",
        "ttfbMs": 149,
        "lcpMs": 396,
        "cls": 0,
        "htmlKB": 29,
        "requests": 7
      },
      {
        "page": "oficios-lista",
        "ttfbMs": 173,
        "lcpMs": 424,
        "cls": 0,
        "htmlKB": 496,
        "requests": 10
      },
      {
        "page": "ordens-lista",
        "ttfbMs": 33,
        "lcpMs": 216,
        "cls": 0,
        "htmlKB": 21,
        "requests": 9
      },
      {
        "page": "palestras-lista",
        "ttfbMs": 24,
        "lcpMs": 272,
        "cls": 0,
        "htmlKB": 10,
        "requests": 6
      },
      {
        "page": "planos-lista",
        "ttfbMs": 40,
        "lcpMs": 256,
        "cls": 0,
        "htmlKB": 18,
        "requests": 8
      },
      {
        "page": "prestacoes-lista",
        "ttfbMs": 321,
        "lcpMs": 656,
        "cls": 0,
        "htmlKB": 656,
        "requests": 11
      },
      {
        "page": "publicacoes-lista",
        "ttfbMs": 33,
        "lcpMs": 188,
        "cls": 0,
        "htmlKB": 82,
        "requests": 6
      },
      {
        "page": "relatorios",
        "ttfbMs": 25,
        "lcpMs": 212,
        "cls": 0,
        "htmlKB": 18,
        "requests": 6
      },
      {
        "page": "roteiros-lista",
        "ttfbMs": 72,
        "lcpMs": 348,
        "cls": 0,
        "htmlKB": 196,
        "requests": 7
      },
      {
        "page": "solicitacoes-lista",
        "ttfbMs": 126,
        "lcpMs": 452,
        "cls": 0,
        "htmlKB": 301,
        "requests": 7
      },
      {